{
  "routes": [
    {
      "route": "/",
      "rewrite": "/landing-options.html"
    },
    {
      "route": "/client360",
      "rewrite": "/client-360.html"
    },
    {
      "route": "/full",
      "rewrite": "/index.html"
    }
  ],
  "navigationFallback": {
    "rewrite": "/landing-options.html",
    "exclude": ["/images/*.{png,jpg,gif,svg}", "/css/*", "/js/*"]
  },
  "globalHeaders": {
    "content-security-policy": "default-src 'self' 'unsafe-inline' https://fonts.googleapis.com https://fonts.gstatic.com; img-src 'self' data:; font-src 'self' https://fonts.gstatic.com;",
    "X-Frame-Options": "SAMEORIGIN",
    "X-XSS-Protection": "1; mode=block"
  },
  "mimeTypes": {
    ".json": "application/json",
    ".css": "text/css",
    ".js": "text/javascript",
    ".html": "text/html",
    ".svg": "image/svg+xml"
  }
}